timestamp	user.id	role	turn.number	anonymised	edited	responding.to	sequence	seq.type	focus	resource	assessment
2021-01-29 12:52:22	teacher008	teacher	121	Yes, absolutely! You knew that, right? The inversion	Yes, absolutely! You knew that, right? The inversion						
2021-01-29 12:53:04	student014	student	122	Yes, but for some reasons I completely removed it from the sentence...	Yes, but for some reasons I completely removed it from the sentence...						
2021-01-29 12:53:33	teacher008	teacher	123	No worries, it happens. I'm just trying to see whether you'd like any explanation from me or whether you've got it	No worries, it happens. I'm just trying to see whether you'd like any explanation from me or whether you've got it						
2021-01-29 12:53:45	teacher008	teacher	124	Ok, I think we'll manage one more today! This comment:	Ok, I think we'll manage one more today! This comment:		4e	exercise	lexical resource,reading	website	
2021-01-29 12:53:48	teacher008	teacher	125	I'm 'middle class' by classic definition. In reality, that meant I had educated parents, a nice stable home. I had a good education, but my parents didn't give me a leg up beyond that - I didn't benefit from connections, or even money, particularly (we weren't hugely well off). None of that is meant to be a hard luck/self made man story, I had a good start.	I'm 'middle class' by classic definition. In reality, that meant I had educated parents, a nice stable home. I had a good education, but my parents didn't give me a leg up beyond that - I didn't benefit from connections, or even money, particularly (we weren't hugely well off). None of that is meant to be a hard luck/self made man story, I had a good start.						
2021-01-29 12:54:15	teacher008	teacher	126	Can you spot a nice idiom?	Can you spot a nice idiom?						
2021-01-29 12:54:27	student014	student	127	give a leg up	give a leg up						
2021-01-29 12:54:50	teacher008	teacher	128	Yes, exactly. Also very intuitive	Yes, exactly. Also very intuitive						
2021-01-29 12:55:09	teacher008	teacher	129	If you're helping your one-year-old climb onto a sofa, you're giving them a leg up	If you're helping your one-year-old climb onto a sofa, you're giving them a leg up			scaffolding	lexical resource,meaning		
2021-01-29 12:55:10	student014	student	130	It means to help someone?	It means to help someone?			enquiry	lexical resource,meaning		
2021-01-29 12:55:42	teacher008	teacher	131	And metaphorically, if you're sending them to a better school, paying for university, pulling a few strings so that they can get a nice job etc. etc.	And metaphorically, if you're sending them to a better school, paying for university, pulling a few strings so that they can get a nice job etc. etc.			scaffolding	lexical resource,meaning		
2021-01-29 12:55:48	student014	student	132	I see :)	I see :)						
2021-01-29 12:56:01	teacher008	teacher	133	To help, in a way that gives them an advantage they can move from	To help, in a way that gives them an advantage they can move from	130.0		scaffolding	lexical resource,meaning		
2021-01-29 12:56:25	teacher008	teacher	134	Is 'pull a few strings' familiar?	Is 'pull a few strings' familiar?		4f	eliciting	lexical resource,meaning		
2021-01-29 12:57:10	student014	student	135	Yes...that means to use some of your connections in order to obtain something	Yes...that means to use some of your connections in order to obtain something						
2021-01-29 12:57:13	student014	student	136	right?	right?						
2021-01-29 12:57:17	teacher008	teacher	137	Yes, absolutely!	Yes, absolutely!						
2021-01-29 12:58:10	teacher008	teacher	138	Ok! Let's see what we've got for next week. Are Monday and Wednesday still no good for you? Because I could offer you a class at 9 am...	Ok! Let's see what we've got for next week. Are Monday and Wednesday still no good for you? Because I could offer you a class at 9 am...		6.0	closing			
2021-01-29 12:58:29	student014	student	139	Monday is still not good	Monday is still not good						
2021-01-29 12:58:40	student014	student	140	Maybe on Wednesday we can do it	Maybe on Wednesday we can do it						
2021-01-29 12:58:58	teacher008	teacher	141	Wednesday 9 am? Would this be ok?	Wednesday 9 am? Would this be ok?						
2021-01-29 12:59:23	student014	student	142	Okay	Okay						
2021-01-29 12:59:38	student014	student	143	Then see you on Wednesday :) And thank you for the lesson!	Then see you on Wednesday :) And thank you for the lesson!						
2021-01-29 12:59:42	student014	student	144	Have a nice weekend!	Have a nice weekend!						
2021-01-29 12:59:45	teacher008	teacher	145	Lovely, thank you! I do appreciate you accommodating this	Lovely, thank you! I do appreciate you accommodating this						
2021-01-29 13:00:04	teacher008	teacher	146	Hope the madness will be over in March! Have a lovely weekend, thank you!	Hope the madness will be over in March! Have a lovely weekend, thank you!						
2021-01-29 13:00:21	student014	student	147	Me too! Thank you again and bye :)	Me too! Thank you again and bye :)						C2
