timestamp	user.id	role	turn.number	anonymised	edited	responding.to	sequence	seq.type	focus	resource	assessment
2020-12-14 14:26:02	teacher008	teacher	151	It was a historic day in the history of my country (because something really important happened)	It was a historic day in the history of my country (because something really important happened)			scaffolding	lexical resource,meaning		
2020-12-14 14:26:06	teacher008	teacher	152	a historic vote	a historic vote			scaffolding	lexical resource		
2020-12-14 14:26:10	teacher008	teacher	153	historic election	historic election			scaffolding	lexical resource		
2020-12-14 14:26:52	teacher008	teacher	154	historical = connected with a study of history	historical = connected with a study of history			scaffolding	lexical resource,meaning		
2020-12-14 14:27:15	teacher008	teacher	155	a historical document (we learn a lot of history from it)	a historical document (we learn a lot of history from it)			scaffolding	lexical resource,meaning		
2020-12-14 14:27:23	teacher008	teacher	156	a historical novel (a novel about history)	a historical novel (a novel about history)			scaffolding	lexical resource,meaning		
2020-12-14 14:27:34	student015	student	157	So historic means important in history, historical just means history?	So historic means important in history, historical just means history?		5a	enquiry	lexical resource,meaning		
2020-12-14 14:28:14	teacher008	teacher	158	Yes, historical is about history as a study of the past	Yes, historical is about history as a study of the past			scaffolding	lexical resource,meaning		
2020-12-14 14:28:21	teacher008	teacher	159	let me think of more examples	let me think of more examples						
2020-12-14 14:28:28	student015	student	160	OK.	OK.						
2020-12-14 14:29:59	teacher008	teacher	161	If we say a city is historic, a lot of important things happened there	If we say a city is historic, a lot of important things happened there			scaffolding	lexical resource,meaning		
2020-12-14 14:30:24	teacher008	teacher	162	Cambridge is a historic city, the home of the famous university.	Cambridge is a historic city, the home of the famous university.			scaffolding	lexical resource,meaning		
2020-12-14 14:30:58	teacher008	teacher	163	But my little town is not historic. It has never been an important place. It has some historical buildings (from the past)	But my little town is not historic. It has never been an important place. It has some historical buildings (from the past)			scaffolding	lexical resource,meaning		
2020-12-14 14:31:14	student015	student	164	Yes. we stress the important means of the city if we say the city is historic	Yes. We stress the importance of the city if we say the city is historic						
2020-12-14 14:31:30	teacher008	teacher	165	Yes, absolutely!	Yes, absolutely!						
2020-12-14 14:31:45	teacher008	teacher	166	Is your hometown historic? Was it important in history?	Is your hometown historic? Was it important in history?		5b	eliciting	lexical resource,meaning		
2020-12-14 14:31:58	student015	student	167	I think I understand the difference.	I think I understand the difference.	165.0					
2020-12-14 14:32:21	student015	student	168	No. My hometown is a small city.	No. My hometown is a small city.						
2020-12-14 14:32:35	teacher008	teacher	169	I see!	I see!						
2020-12-14 14:33:06	teacher008	teacher	170	Ok, lovely, I'll let you go now. Speak to you on Thursday, have a lovely week! Well done today!	Ok, lovely, I'll let you go now. Speak to you on Thursday, have a lovely week! Well done today!		6.0	closing			
2020-12-14 14:33:30	student015	student	171	OK. Thanks.	OK. Thanks.						
2020-12-14 14:33:41	student015	student	172	See you on Thursday.	See you on Thursday.						
2020-12-14 14:33:54	teacher008	teacher	173	Bye!	Bye!						
2020-12-14 14:34:00	student015	student	174	Bye!	Bye!						B2
