timestamp	user.id	role	turn.number	anonymised	edited	responding.to	sequence	seq.type	focus	resource	assessment
2021-06-15 11:01:30	student014	student	1	Hi Olga!	Hi <TEACHER>!		1.0	opening			
2021-06-15 11:01:42	teacher008	teacher	2	Hi Giovanni!	Hi <STUDENT>!						
2021-06-15 11:01:46	teacher008	teacher	3	How are you?	How are you?		2.0	topic opening			
2021-06-15 11:03:50	student014	student	4	Good, thank you! How about you?	Good, thank you! How about you?						
2021-06-15 11:04:33	teacher008	teacher	5	All good, thank you!	All good, thank you!						
2021-06-15 11:04:54	teacher008	teacher	6	Thanks for your essay, I really enjoyed reading it! Some very nice language there :)	Thanks for your essay, I really enjoyed reading it! Some very nice language there :)		3.0	topic opening	writing	student's writing	
2021-06-15 11:05:28	teacher008	teacher	7	I especially liked the inverted third conditional :)	I especially liked the inverted third conditional :)						
2021-06-15 11:05:44	teacher008	teacher	8	Had it not been for this shared trove of knowledge and rules, it would have been impossible to build today’s nations where millions of people, who are de facto strangers to each other, live and thrive together.	Had it not been for this shared trove of knowledge and rules, it would have been impossible to build today’s nations where millions of people, who are de facto strangers to each other, live and thrive together.						
2021-06-15 11:05:48	teacher008	teacher	9	I mean this one	I mean this one						
2021-06-15 11:06:30	teacher008	teacher	10	Also, it's an elegant summary of the two viewpoints, very nice	Also, it's an elegant summary of the two viewpoints, very nice						
2021-06-15 11:07:19	student014	student	11	Thank you :) As I explained: it took me a while to write it, but I thought that sometimes trying to perfect one's language can be a good exercise :)	Thank you :) As I explained it took me a while to write it, but I thought that sometimes trying to perfect one's language can be a good exercise :)						
2021-06-15 11:09:31	teacher008	teacher	12	Yes, absolutely. If you were in a situation where you have to observe the time limit such as an exam, I'd suggest sticking to a very clear structure with topic sentences, It does speed up the process! (I would say the structure is very clear in the last two paragraphs, but the beginning is more free-flowing)	Yes, absolutely. If you were in a situation where you have to observe the time limit such as an exam, I'd suggest sticking to a very clear structure with topic sentences, It does speed up the process! (I would say the structure is very clear in the last two paragraphs, but the beginning is more free-flowing)		3a	scaffolding	writing		
2021-06-15 11:12:19	student014	student	13	Maybe I should start by writing a topic sentence for each paragraph ;) It took me a long time to write it for multiple reasons, among them the fact that I rewrote someparts...	Maybe I should start by writing a topic sentence for each paragraph ;) It took me a long time to write it for multiple reasons, among them the fact that I rewrote some parts...						
2021-06-15 11:12:25	student014	student	14	*some parts	*some parts			repair	writing		
2021-06-15 11:14:29	teacher008	teacher	15	Yes, a boring but reliable structure. 1. Introduction (signposting early what you're going to write about) 2. topic sentence, expansion 3. topic sentence, expansion	Yes, a boring but reliable structure. 1. Introduction (signposting early what you're going to write about) 2. topic sentence, expansion 3. topic sentence, expansion	13.0		scaffolding	writing		
2021-06-15 11:14:49	teacher008	teacher	16	or maybe 4 too, I'm not saying there should be 3 paragraphs :)	or maybe 4 too, I'm not saying there should be 3 paragraphs :)			scaffolding	writing		
2021-06-15 11:16:17	student014	student	17	Yes, of course :) The problem is that it is difficult to be 'creative' with such a structure...	Yes, of course :) The problem is that it is difficult to be 'creative' with such a structure...						
2021-06-15 11:17:07	student014	student	18	since it is a topic that I'm interested in I had plenty to write about in 'my way'...but, of course, for an exam it's better to choose some topics	since it is a topic that I'm interested in I had plenty to write about in 'my way'...but, of course, for an exam it's better to choose some topics						
2021-06-15 11:17:16	student014	student	19	and produce just what you're asked for :)	and produce just what you're asked for :)						
2021-06-15 11:17:20	teacher008	teacher	20	Yes! But it's also difficult to steer away from the topic and get lost, which is a problem with a lot of exam writing (not yours, actually)	Yes! But it's also difficult to steer away from the topic and get lost, which is a problem with a lot of exam writing (not yours, actually)	18.0					
2021-06-15 11:17:42	teacher008	teacher	21	Yep, that's the trick!	Yep, that's the trick!	19.0					
2021-06-15 11:18:59	teacher008	teacher	22	It is an interesting topic though, isn't it? And the one that's existed since the dawn of time as your video so nicely illustrates :)	It is an interesting topic though, isn't it? And the one that's existed since the dawn of time as your video so nicely illustrates :)		3b	topic development			
2021-06-15 11:20:19	student014	student	23	Yes, it is quite interesting, especially as a parent...and I think that it is becoming more and more apparent, as society changes with greater speeds...	Yes, it is quite interesting, especially as a parent...and I think that it is becoming more and more apparent, as society changes at a greater speed...						
2021-06-15 11:21:37	teacher008	teacher	24	Yes, I'm sure our kids' generation will find ways to shock us even though we might be thinking now that we've seen it all	Yes, I'm sure our kids' generation will find ways to shock us even though we might be thinking now that we've seen it all						
2021-06-15 11:21:39	student014	student	25	If I think about the first time I surfed the internet, I was one of the first in my little town...and now, if we have a problem, that's 'too much' internet...	If I think about the first time I surfed the internet, I was one of the first in my little town...and now, if we have a problem, that's 'too much' internet...	23.0					
2021-06-15 11:22:03	student014	student	26	Haha, indeed...we'll have to wait and see what they come up with	Haha, indeed...we'll have to wait and see what they come up with	24.0					
2021-06-15 11:22:30	teacher008	teacher	27	Anyway, for our final lesson, have you maybe got any questions / anything you'd like to discuss / anything I can help with?	Anyway, for our final lesson, have you maybe got any questions / anything you'd like to discuss / anything I can help with?		4.0	topic opening			
2021-06-15 11:23:51	student014	student	28	Hmm...no, not really...	Hmm...no, not really...						
2021-06-15 11:24:36	student014	student	29	As I told you I've bought the book you sent me via pdf, and I plan on working on it from start to finish	As I told you I've bought the book you sent me via pdf, and I plan on working on it from start to finish		4a	topic development	meta knowledge		
2021-06-15 11:25:01	teacher008	teacher	30	Oh really? I must have missed it somehow! The orange one?	Oh really? I must have missed it somehow! The orange one?						
2021-06-15 11:25:14	student014	student	31	Yes, from Longman :)	Yes, from Longman :)						
2021-06-15 11:25:46	teacher008	teacher	32	I see, oh it's really good, I'm sure you'll enjoy it!	I see, oh it's really good, I'm sure you'll enjoy it!						
2021-06-15 11:25:57	student014	student	33	But then, if you have some exercises or interesting sayings with difficult vocabulary, that would be fine for me :)	But then, if you have some exercises or interesting sayings with difficult vocabulary, that would be fine for me :)						
2021-06-15 11:26:17	student014	student	34	Yes, I like how it is structured! And it is packed with exercises...	Yes, I like how it is structured! And it is packed with exercises...	32.0					
2021-06-15 11:26:27	teacher008	teacher	35	Yes, I do have something prepared, we'll get to it in a second, just wanted to check with you first	Yes, I do have something prepared, we'll get to it in a second, just wanted to check with you first	33.0					
2021-06-15 11:28:07	teacher008	teacher	36	You probably do it anyway, but I do recommend reading good quality media in English, I do believe it helps with the language a lot!	You probably do it anyway, but I do recommend reading good quality media in English, I do believe it helps with the language a lot!		4b	topic development	meta knowledge		
2021-06-15 11:29:03	teacher008	teacher	37	I know I've become a better writer because I do like my Guardian articles :)	I know I've become a better writer because I do like my Guardian articles :)						
2021-06-15 11:30:05	teacher008	teacher	38	What do you prefer to read in English?	What do you prefer to read in English?		4c	topic development	meta knowledge		
2021-06-15 11:31:27	student014	student	39	I read mostly books...from biographies, to science and technology related treaties...	I read mostly books...from biographies to science and technology related treaties...						
2021-06-15 11:31:57	student014	student	40	Sometimes I skim through bbc or cnn, but I find it hard to read with a attention a whole article on my mobile phone...	Sometimes I skim through bbc or cnn, but I find it hard to read attentively a whole article on my mobile phone...						
2021-06-15 11:32:36	student014	student	41	Oh, I also read a lot of scientific articles on machine learning, but the quality of the language there is mixed...	Oh, I also read a lot of scientific articles on machine learning, but the quality of the language there is mixed...						
2021-06-15 11:33:28	teacher008	teacher	42	Right, sure, the quality of the language is not the main point there I can imagine	Right, sure, the quality of the language is not the main point there I can imagine						
2021-06-15 11:34:26	teacher008	teacher	43	I think an opinion article is as close as it gets 'in real life' to those exam essays, and they're usually full of good language	I think an opinion article is as close as it gets 'in real life' to those exam essays, and they're usually full of good language			scaffolding	meta knowledge		
2021-06-15 11:34:44	student014	student	44	It should be of some concern...but currently the pace at which articles in ML (machine learning) is out of control...which leads to lower quality in many aspects (including language)	It should be of some concern...but currently the pace at which articles in ML (machine learning) appear is out of control...which leads to lower quality in many aspects (including language)	42.0					
2021-06-15 11:35:39	student014	student	45	Indeed...they also have the advantage of being 'short': I am used to long texts, but in real life you often need to be synthetic	Indeed...they also have the advantage of being 'short': I am used to long texts, but in real life you often need to be synthetic	43.0					
2021-06-15 11:35:51	teacher008	teacher	46	Interesting! You're in a very dynamic field	Interesting! You're in a very dynamic field	44.0					
2021-06-15 11:36:47	teacher008	teacher	47	Yes, absolutely, they are quite concise and pack a lot in a small space	Yes, absolutely, they are quite concise and pack a lot in a small space	45.0					
2021-06-15 11:37:55	teacher008	teacher	48	Anyway, a little something I've prepared for you to practice those past conditionals (if you have the book handy, feel free to open this chapter, the one we were working on last time)	Anyway, a little something I've prepared for you to practice those past conditionals (if you have the book handy, feel free to open this chapter, the one we were working on last time)		5.0	exercise	grammatical resource		
2021-06-15 11:38:35	teacher008	teacher	49	I'm going to tell you a story and invite you to speculate about what could have happened if people had acted differently :)	I'm going to tell you a story and invite you to speculate about what could have happened if people had acted differently :)						
2021-06-15 11:38:42	student014	student	50	I would dare to say that, to a point, it is a fad...a lot of people have been blinded by the promises of artificial intelligence, money is flowing and people are trying to apply it to everything...still it is very interesting and dynamic, indeed!	I would dare to say that, to a point, it is a fad...a lot of people have been blinded by the promises of artificial intelligence, money is flowing and people are trying to apply it to everything...still it is very interesting and dynamic, indeed!	46.0	4d	topic development			
2021-06-15 11:38:58	student014	student	51	Okay! I have the book here, but I don't remember the page...	Okay! I have the book here, but I don't remember the page...	49.0	5a	enquiry			
2021-06-15 11:39:18	teacher008	teacher	52	One second, I'll find it	One second, I'll find it						
2021-06-15 11:40:19	teacher008	teacher	53	A fad? Very interesting, coming from you! As I said before, my main objection from the user side of it is 'artificial empathy'. It just doesn't work in my opinion!	A fad? Very interesting, coming from you! As I said before, my main objection from the user side of it is 'artificial empathy'. It just doesn't work in my opinion!	50.0					
2021-06-15 11:41:22	teacher008	teacher	54	It's page 88 in the actual book and page 89 in the pdf	It's page 88 in the actual book and page 89 in the pdf	52.0					
2021-06-15 11:42:01	teacher008	teacher	55	Ok, the story!	Ok, the story!		5b	exercise	grammatical resource		
2021-06-15 11:42:36	student014	student	56	Haha...not in all aspects, but in some, for instance empathy...or creating an artificial psychiatrist ;) Yes, the story!	Haha...not in all aspects, but in some, for instance empathy...or creating an artificial psychiatrist ;) Yes, the story!	53.0					
2021-06-15 11:45:10	student014	student	57	Are you still here?	Are you still here?	55.0					
2021-06-15 11:45:36	teacher008	teacher	58	It's about a poor musician called Anton who lived in a small fishing village. He and the daughter of a rich fisherman, Barbara, were in love, and he went to her father to ask for her hand. The father said that he had to have a boat to be able to marry his daughter and provide for her. But Anton did not have a boat, only his guitar! Anton went to his friend Chris, a fisherman, and asked to borrow his boat. But Chris refused him saying that he needed the boat for work. Barbara and Anton broked up. Heartbroken, Anton proposed to another girl, Elizabeth, but Elizabeth said he was still in love with Barbara and turned him down. Anton was unhappy and unmarried then. But who was to blame?	It's about a poor musician called Anton who lived in a small fishing village. He and the daughter of a rich fisherman, Barbara, were in love, and he went to her father to ask for her hand. The father said that he had to have a boat to be able to marry his daughter and provide for her. But Anton did not have a boat, only his guitar! Anton went to his friend Chris, a fisherman, and asked to borrow his boat. But Chris refused him saying that he needed the boat for work. Barbara and Anton broked up. Heartbroken, Anton proposed to another girl, Elizabeth, but Elizabeth said he was still in love with Barbara and turned him down. Anton was unhappy and unmarried then. But who was to blame?						
2021-06-15 11:45:46	teacher008	teacher	60	Sorry, still here, but a long story!	Sorry, still here, but a long story!	57.0					
2021-06-15 11:46:16	teacher008	teacher	61	in third conditional sentences, please :)	in third conditional sentences, please :)						
2021-06-15 11:49:12	student014	student	62	If Anton had a boat he would have been able to support a family and Barbara's father would have granted her hand.	If Anton had had a boat he would have been able to support a family and Barbara's father would have granted her hand.						
2021-06-15 11:49:12	teacher008	teacher	63	*broke up, not broked!	*broke up, not broked!	58.0		repair	writing		
2021-06-15 11:49:45	teacher008	teacher	64	Nearly! If Anton ___ ___ a boat,	Nearly! If Anton ___ ___ a boat,		5c	eliciting,repair	grammatical resource		
2021-06-15 11:49:52	student014	student	65	had had?	had had?						
2021-06-15 11:50:15	teacher008	teacher	66	Yes!	Yes!						
2021-06-15 11:51:18	teacher008	teacher	67	Or Barbara's father should have been more open-minded?	Or Barbara's father should have been more open-minded?		5d	exercise	grammatical resource		
2021-06-15 11:51:28	student014	student	68	If Christ hadn't needed the boat for work he would have borrowed it to Anton.	If Chris hadn't needed the boat for work, he would have lent it to Anton.						
2021-06-15 11:52:21	teacher008	teacher	69	My guess is that in Italian 'borrow' and 'lend' are the same verb :) he would have lent it to Anton!	My guess is that in Italian 'borrow' and 'lend' are the same verb :) he would have lent it to Anton!		5e	repair	lexical resource		
2021-06-15 11:52:29	student014	student	70	If Barbara's father had grew up in another time he would have been more open-minded and let Barbara choose who to marry.	If Barbara's father had grown up in another time he would have been more open-minded and let Barbara choose who to marry.	67.0					
2021-06-15 11:52:58	teacher008	teacher	71	Nearly! had ___ up in another time	Nearly! had ___ up in another time		5f	eliciting,repair	grammatical resource		
2021-06-15 11:53:23	student014	student	72	They are indeed, but to be fair I was a bit dubious about which verb to use...	They are indeed, but to be fair I was a bit dubious about which verb to use...	69.0					
2021-06-15 11:53:46	student014	student	73	grown	grown	71.0					
2021-06-15 11:54:14	teacher008	teacher	74	lend (lent, lent) = let someone temporarily have something that belongs to you	lend (lent, lent) = let someone temporarily have something that belongs to you	72.0		scaffolding	lexical resource,meaning		
2021-06-15 11:54:50	teacher008	teacher	75	borrow: borrow some money from a bank, borrow a book from the library, May I borrow your pen, please?	borrow: borrow some money from a bank, borrow a book from the library, May I borrow your pen, please?			scaffolding	lexical resource,meaning		
2021-06-15 11:55:34	teacher008	teacher	76	And which of them is a synonym of 'loan'?	And which of them is a synonym of 'loan'?		5g	eliciting	lexical resource,meaning		
2021-06-15 11:55:46	student014	student	77	I see :) The difference is between the fact that you are actively 'giving' something or 'taking' something...	I see :) The difference is between the fact that you are actively 'giving' something or 'taking' something...	75.0					
2021-06-15 11:56:24	student014	student	78	A loan is something you ask to the bank, so I'd go for 'borrow'...	A loan is something you ask a bank for, so I'd go for 'borrow'...	76.0					
2021-06-15 11:56:36	student014	student	79	But I didn't know load is a verb too	But I didn't know loan was a verb too						
2021-06-15 11:57:13	teacher008	teacher	80	Yes! Like in Italian, it's the same verb in my native language, so I could recognize the problem :) But there's a very clear distinction in English. Also, you don't use 'have' instead of 'borrow'	Yes! Like in Italian, it's the same verb in my native language, so I could recognize the problem :) But there's a very clear distinction in English. Also, you don't use 'have' instead of 'borrow'	77.0		scaffolding	lexical resource,meaning		
2021-06-15 11:57:28	teacher008	teacher	81	There's a big difference between 'you can have it' and 'you can borrow it'!	There's a big difference between 'you can have it' and 'you can borrow it'!			scaffolding	lexical resource,meaning		
2021-06-15 11:57:41	teacher008	teacher	82	If you say 'you can have it', you don't expect 'it' back!	If you say 'you can have it', you don't expect 'it' back!			scaffolding	lexical resource,meaning		
2021-06-15 11:57:42	student014	student	83	That's quite clear to me	That's quite clear to me						
2021-06-15 11:57:51	teacher008	teacher	84	Ok, sure!	Ok, sure!						
2021-06-15 11:58:23	teacher008	teacher	85	to take out a loan / apply for a bank loan means to borrow money from a bank or to try to do so	to take out a loan / apply for a bank loan means to borrow money from a bank or to try to do so	79.0		scaffolding	lexical resource,meaning		
2021-06-15 11:58:25	student014	student	86	Haha I know :) Unless you say something like 'you can have it for a couple of days, but I need it this Sunday'	Haha I know :) Unless you say something like 'you can have it for a couple of days, but I need it this Sunday'	84.0					
2021-06-15 11:58:41	teacher008	teacher	87	But 'to loan' means 'to lend'	But 'to loan' means 'to lend'	85.0		scaffolding	lexical resource,meaning		
2021-06-15 11:58:56	student014	student	88	(I hope I'm not making up an expression) Oh...okay	(I hope I'm not making up an expression) Oh...okay	86, 87					
2021-06-15 11:58:57	teacher008	teacher	89	Banks loan money	Banks loan money	87.0		scaffolding	lexical resource,meaning		
2021-06-15 11:59:21	teacher008	teacher	90	Yes, exactly, it would be clearer to say 'you can borrow it for a couple of days!'	Yes, exactly, it would be clearer to say 'you can borrow it for a couple of days!'	86.0		scaffolding	lexical resource		
2021-06-15 11:59:25	student014	student	91	So my reasoning was wrong...ok...I guess it is more formal	So my reasoning was wrong...ok...I guess it is more formal	89.0					
2021-06-15 11:59:41	student014	student	92	I mean loan is used in more formal situations, right?	I mean loan is used in more formal situations, right?			enquiry	lexical resource,register		
2021-06-15 11:59:46	teacher008	teacher	93	Ooh, we're out of time!	Ooh, we're out of time!		6.0	closing			
2021-06-15 11:59:49	student014	student	94	Or maybe with money/institutions?	Or maybe with money/institutions?	92.0					
2021-06-15 11:59:51	teacher008	teacher	95	Yes, absolutely!	Yes, absolutely!						
2021-06-15 11:59:59	student014	student	96	13:59 on my laptop	13:59 on my laptop	93.0					
2021-06-15 12:00:03	teacher008	teacher	97	Loan is more formal!	Loan is more formal!			scaffolding	lexical resource,register		
2021-06-15 12:00:30	teacher008	teacher	98	Right, thank you very much for participating in this project! It's been a pleasure to chat with you over the last few months :)	Right, thank you very much for participating in this project! It's been a pleasure to chat with you over the last few months :)	96.0					
2021-06-15 12:01:01	teacher008	teacher	99	You've still got my email address if you'd like to contact me one day, I'll be very happy to hear from you!	You've still got my email address if you'd like to contact me one day, I'll be very happy to hear from you!						
2021-06-15 12:01:13	student014	student	100	Thank you! It was a pleasure for me too! And also a great opportunity for me, and science :)	Thank you! It was a pleasure for me too! And also a great opportunity for me, and science :)						
2021-06-15 12:01:48	student014	student	101	Of couse! You have my e-mail too, for instnace if you ever need some suggestions about what to visit in Italy ;)	Of course! You have my e-mail too, for instance if you ever need some suggestions about what to visit in Italy ;)	99.0					
2021-06-15 12:02:12	student014	student	102	Thank you again! And have a great summer! Bye, bye!	Thank you again! And have a great summer! Bye, bye!	100.0					
2021-06-15 12:02:21	teacher008	teacher	103	Oh that would be so nice, I hope we can go next year! I'll definitely turn to you for suggestions	Oh that would be so nice, I hope we can go next year! I'll definitely turn to you for suggestions	101.0					
2021-06-15 12:02:36	teacher008	teacher	104	Thank you, and all the best to you and your family! Bye <STUDENT>!	Thank you, and all the best to you and your family! Bye <STUDENT>!	102.0					C2
