timestamp	user.id	role	turn.number	anonymised	edited	responding.to	sequence	seq.type	focus	resource	assessment
2020-11-17 12:50:16	student014	student	110	he gave a general idea of the fundamentals of different topics: our logical system, limits and possibilities of our ability to understand and our science, limits imposed on us by the physical laws.	he gave a general idea of the fundamentals of different topics: our logical system, limits and possibilities of our ability to understand and our science, limits imposed on us by physical laws.						
2020-11-17 12:50:50	teacher008	teacher	111	Or shall we get rid of fundamentals? because 'a general idea' implies something fundamental when it comes to science I suppose. What do you think?	Or shall we get rid of fundamentals? because 'a general idea' implies something fundamental when it comes to science I suppose. What do you think?	107.0	3c	scaffolding	lexical resource		
2020-11-17 12:50:53	student014	student	112	I guess I should then explain a bit what I mean with each of these topics....	I guess I should then explain a bit what I mean with each of these topics....	110.0					
2020-11-17 12:51:19	teacher008	teacher	113	Aha, I'm getting a clearer idea now	Aha, I'm getting a clearer idea now						
2020-11-17 12:51:21	student014	student	114	I see...	I see...	111.0					
2020-11-17 12:51:43	student014	student	115	Well, maybe it would be better to get rid of 'fundamentals', or to write something slightly different:	Well, maybe it would be better to get rid of 'fundamentals', or to write something slightly different:						
2020-11-17 12:52:22	student014	student	116	he gave a general idea of some of the fundamental ideas in different topics	he gave a general idea of some of the fundamental ideas in different topics						
2020-11-17 12:52:42	teacher008	teacher	117	a general idea of the workings of our logical system, the limits and possibilities of understanding science and the limits imposed on us by physical laws	a general idea of the workings of our logical system, the limits and possibilities of understanding science and the limits imposed on us by physical laws			scaffolding	lexical resource,writing		
2020-11-17 12:52:47	teacher008	teacher	118	just a suggestion	just a suggestion						
2020-11-17 12:53:49	teacher008	teacher	119	Actually, with two 'limits' in one sentence, could you choose a synonym for one of them?	Actually, with two 'limits' in one sentence, could you choose a synonym for one of them?		3d	eliciting	lexical resource,writing		
2020-11-17 12:54:08	student014	student	120	Hmm	Hmm						
2020-11-17 12:55:13	teacher008	teacher	121	for example, 'constraints'?	for example, 'constraints'?			scaffolding	lexical resource		
2020-11-17 12:55:20	student014	student	122	the limits and possibilities of human understanding and science in general, and the constraints imposed on us by physical laws	the limits and possibilities of human understanding and science in general, and the constraints imposed on us by physical laws						
2020-11-17 12:55:33	teacher008	teacher	123	I like it very much, yes!	I like it very much, yes!						
2020-11-17 12:56:01	student014	student	124	I was also thinking of 'limitations', but I wouldn't use that as a substitute of 'limit'	I was also thinking of 'limitations', but I wouldn't use that as a substitute for 'limit'						
2020-11-17 12:56:27	student014	student	125	(I mean, it sounds almost the same)	(I mean, it sounds almost the same)						
2020-11-17 12:57:14	teacher008	teacher	126	Yes, exactly	Yes, exactly						
2020-11-17 12:57:35	teacher008	teacher	127	I believe, other than the fact that this many different ideas packed in little more than 200 pages makes it not a very fit as a 'goodnight read' , there are two main issues with the book:	I believe, other than the fact that this many different ideas packed in little more than 200 pages makes it not a very fit as a 'goodnight read' , there are two main issues with the book:		3e	exercise	writing,lexical resource,grammatical resource	student's writing	
2020-11-17 12:58:24	teacher008	teacher	128	I know we only have a couple of minutes, could you give me some words that would be a more precise fit than 'not very fit for a goodnight read'. What kind of read is it?	I know we only have a couple of minutes, could you give me some words that would be a more precise fit than 'not very fit for a goodnight read'. What kind of read is it?			eliciting	lexical resource		
2020-11-17 12:59:40	student014	student	129	not a light read, but fit only to be read slowly and trying to understand each new page	not a light read, but fit only to be read slowly and trying to understand each new page						
2020-11-17 12:59:49	student014	student	130	I wouldn't know how to put it in different words	I wouldn't know how to put it in different words						
2020-11-17 13:00:31	teacher008	teacher	131	a heavy read is very colloquial, but it is what you're saying here	a heavy read is very colloquial, but it is what you're saying here			scaffolding	lexical resource		
2020-11-17 13:00:36	teacher008	teacher	132	a difficult text	a difficult text			scaffolding	lexical resource		
2020-11-17 13:00:43	student014	student	133	Yes, I guess	Yes, I guess						
2020-11-17 13:00:56	teacher008	teacher	134	a slow read, too	a slow read, too			scaffolding	lexical resource		
2020-11-17 13:01:03	teacher008	teacher	135	things like that	things like that						
2020-11-17 13:01:13	teacher008	teacher	136	not a light read - sure	not a light read - sure	129.0					
2020-11-17 13:01:13	student014	student	137	a slow and heavy read...	a slow and heavy read...						
2020-11-17 13:01:26	student014	student	138	on a text written in very tiny characters	a text written in very tiny characters						
2020-11-17 13:01:30	teacher008	teacher	139	Yes, sure!	Yes, sure!	137.0					
2020-11-17 13:01:30	student014	student	140	*with very	*in very	138.0		repair	lexical resource		
2020-11-17 13:01:39	teacher008	teacher	141	Oh, is the print small?	Oh, is the print small?						
2020-11-17 13:02:00	student014	student	142	Yes, that was also a problem...it was 200 pages, but in normal text it woudl have probably been more like 300	Yes, that was also a problem...it was 200 pages, but in normal print it would have probably been more like 300						
2020-11-17 13:02:37	student014	student	143	But that was only an additional probelm	But that was only an additional problem						
2020-11-17 13:02:47	student014	student	144	the problem was that you could never 'relax' while reading	the problem was that you could never 'relax' while reading						
2020-11-17 13:02:47	teacher008	teacher	145	Oh I hate that :) small print is so annoying!	Oh I hate that :) small print is so annoying!	142.0					
2020-11-17 13:03:07	teacher008	teacher	146	or, to put it less colloquially, it puts a lot of strain on eyes	or, to put it less colloquially, it puts a lot of strain on eyes			scaffolding	lexical resource		
2020-11-17 13:03:22	student014	student	147	Indeed it does	Indeed it does						
2020-11-17 13:03:27	teacher008	teacher	148	Anyway, I've got to let you go! We will think about it some more next time!	Anyway, I've got to let you go! We will think about it some more next time!		4.0	closing			
2020-11-17 13:03:40	student014	student	149	Okay, thank you for your help	Okay, thank you for your help						
2020-11-17 13:03:43	student014	student	150	Have a nice week!!	Have a nice week!!						
2020-11-17 13:03:54	teacher008	teacher	151	You're very welcome, have a good week too, thank you!	You're very welcome, have a good week too, thank you!						C2
