timestamp	user.id	role	turn.number	anonymised	edited	responding.to	sequence	seq.type	focus	resource	assessment
2020-11-24 12:56:00	teacher008	teacher	151	Sure	Sure						
2020-11-24 12:56:07	teacher008	teacher	152	now, akin to = similar to	now, akin to = similar to			scaffolding	lexical resource		
2020-11-24 12:56:22	teacher008	teacher	153	are they similar to science fiction or are they actually science fiction?	are they similar to science fiction or are they actually science fiction?			eliciting	lexical resource,meaning		
2020-11-24 12:58:20	student014	student	154	similar to...even though it wouldn't be the correct term...	similar to...even though it wouldn't be the correct term...						
2020-11-24 12:58:53	teacher008	teacher	155	No, that's the problem	No, that's the problem						
2020-11-24 12:59:34	teacher008	teacher	156	I believe the book devoted too many pages to theories which, while interesting, can't be proved through experiment and thus belong in the realm of science fiction, not science.	I believe the book devoted too many pages to theories which, while interesting, can't be proved through experiment and thus belong in the realm of science fiction, not science.		3n	scaffolding	writing,lexical resource		
2020-11-24 13:00:02	teacher008	teacher	157	just an option, more of an idea of 'being classified as' or 'belonging' than similarity	just an option, more of an idea of 'being classified as' or 'belonging' than similarity			scaffolding	lexical resource,meaning,writing		
2020-11-24 13:00:17	student014	student	158	indeed	indeed						
2020-11-24 13:00:18	student014	student	159	would	would						
2020-11-24 13:00:35	teacher008	teacher	160	I did like some of your sentences today! Complex but clear!	I did like some of your sentences today! Complex but clear!						
2020-11-24 13:00:50	student014	student	161	belong more to the realm of science fiction than to the one of science	belong more to the realm of science fiction than to the one of science	159.0					
2020-11-24 13:00:53	student014	student	162	thank you!	thank you!	160.0					
2020-11-24 13:01:13	teacher008	teacher	163	My pleasure	My pleasure						
2020-11-24 13:01:24	student014	student	164	what is the difference between 'belong to the realm' and 'belong in the realm of'?	what is the difference between 'belong to the realm' and 'belong in the realm of'?		3o	enquiry	lexical resource		
2020-11-24 13:01:31	student014	student	165	are they both correct?	are they both correct?						
2020-11-24 13:01:33	teacher008	teacher	166	Have a lovely week, looking forward to speaking to you next Tuesday! (same time, right?)	Have a lovely week, looking forward to speaking to you next Tuesday! (same time, right?)		4.0	closing			
2020-11-24 13:01:44	teacher008	teacher	167	I think they're both good!	I think they're both good!	165.0					
2020-11-24 13:01:52	teacher008	teacher	168	belong goes with to, as you know	belong goes with to, as you know			scaffolding	lexical resource		
2020-11-24 13:02:01	teacher008	teacher	169	but also, belong (where)	but also, belong (where)			scaffolding	lexical resource		
2020-11-24 13:02:11	student014	student	170	I see...	I see...						
2020-11-24 13:02:12	teacher008	teacher	171	as in 'you don't belong here'	as in 'you don't belong here'			scaffolding	lexical resource		
2020-11-24 13:03:02	student014	student	172	Okay, perfect thank you!	Okay, perfect thank you!						
2020-11-24 13:03:10	student014	student	173	It's already 14:03	It's already 14:03		4a				
2020-11-24 13:03:25	teacher008	teacher	174	Yes, I'll let you go! Speak to you next week	Yes, I'll let you go! Speak to you next week						
2020-11-24 13:03:47	student014	student	175	Great! Thank you for your help and have a nice week!!	Great! Thank you for your help and have a nice week!!						
2020-11-24 13:03:57	teacher008	teacher	176	You're very welcome, bye!	You're very welcome, bye!						
2020-11-24 13:04:08	student014	student	177	Bye!	Bye!						C2
